{
  "family": "venture",
  "schema_version": "0.1",
  "id": "tallyhouse_good_better_best",
  "title": "Good, Better, Best",
  "version": "1.0.0",
  "meta": {
    "domain": "product",
    "seat": "product_manager",
    "order": 4,
    "audience": ["product-managers", "apm", "product-students"],
    "est_minutes": 75,
    "locale": "en-IN",
    "inspiration": "A product manager's year in a company with a problem: four quarters, a squad, hidden facts that sponsors state wrongly, one market event and a plan for the year after.",
    "rights_note": "Original scenario. The company, the people, the product and every number are invented."
  },
  "company": {
    "name": "Tallyhouse",
    "one_liner": "A B2B time-tracking and project-profitability tool for creative agencies whose growth has plateaued on one plan at one price.",
    "stage": "Seed-plus, losing about ₹60 lakh a quarter, with about six quarters of cash",
    "market": "Creative agencies in India and Southeast Asia: design studios, advertising shops, web agencies",
    "business_model": "A monthly subscription per account, one plan at one price.",
    "product": "The core product: time tracking, project budgets, invoicing and reports.",
    "role": "Product manager for the core product. Your squad is seven engineers, two designers and two analysts.",
    "brief": "The chief executive has to show a route to profit within four quarters or the next round is gone. Growth has plateaued on one plan at one price, and every team has a theory. You can see trial starts and payments, but not what happens between. You have four quarters of twelve weeks.",
    "stakeholders": [
      {
        "name": "Farah Siddiqui",
        "role": "Chief Executive",
        "says": "I need a route to profit I can show the board in four quarters. Tell me what gets us there."
      },
      {
        "name": "Vikram Nair",
        "role": "Head of Sales",
        "says": "Three network deals died on security reviews. Give me single sign-on and an audit log and I will close them."
      },
      {
        "name": "Anjali Menon",
        "role": "Finance Lead",
        "says": "Billing complaints are a quarter of the tickets. It is not the problem."
      },
      {
        "name": "Imran Sheikh",
        "role": "Customer Success",
        "says": "Heavy users keep asking to pay for more. A usage add-on will sell itself."
      },
      {
        "name": "Sunita Rao",
        "role": "Chair of the board",
        "says": "One price for everybody leaves money on the table."
      },
      {
        "name": "Prakash Hegde",
        "role": "Head of Engineering",
        "says": "The billing module has caused every outage this year and nobody wants to touch it."
      },
      {
        "name": "Divya Rao",
        "role": "Design Lead",
        "says": "Trials get lost in the first session."
      }
    ]
  },
  "stage_names": ["Trial activated", "Upgrade considered", "Paid"],
  "segments": [
    {
      "id": "solo",
      "name": "Solo and small studios",
      "description": "Freelancers and studios of one to five people.",
      "inflow": 20000,
      "stages": [0.45, 0.1, 0.55],
      "churn": 0.09,
      "arpu": 2100,
      "var_cost": 380,
      "customers": 4800,
      "stage_cost": 40
    },
    {
      "id": "mid",
      "name": "Mid-size agencies",
      "description": "Agencies of six to eighty people.",
      "inflow": 1800,
      "stages": [0.6, 0.35, 0.4],
      "churn": 0.05,
      "arpu": 14000,
      "var_cost": 2100,
      "customers": 2800,
      "stage_cost": 600
    },
    {
      "id": "ent",
      "name": "Networks and enterprise",
      "description": "Networks and holding companies with many offices.",
      "inflow": 140,
      "stages": [0.7, 0.4, 0.3],
      "churn": 0.04,
      "arpu": 95000,
      "var_cost": 12000,
      "customers": 250,
      "stage_cost": 9000
    }
  ],
  "items": [
    {
      "id": "onboarding_wizard",
      "name": "Guided set-up",
      "about": "Guided set-up: import clients, invite a teammate, log a first timesheet.",
      "area": "activation",
      "eng": 15,
      "design": 6,
      "data": 0,
      "clar": 0.7,
      "debt": 1,
      "effects": {
        "solo": {
          "s1": 0.198,
          "s2": 0.066
        },
        "mid": {
          "s1": 0.11
        }
      },
      "sponsor": "design",
      "serves": ["activate", "grow"]
    },
    {
      "id": "tiering",
      "name": "Three-tier packaging",
      "about": "Replace the single plan with three tiers: Good, Better, Best.",
      "area": "monetise",
      "eng": 12,
      "design": 6,
      "data": 2,
      "clar": 0.5,
      "debt": 1,
      "effects": {
        "solo": {
          "arpu": 0.0474,
          "s3": -0.23664
        },
        "mid": {
          "arpu": 0.05925,
          "s3": -0.1972
        },
        "ent": {
          "arpu": 0.0395
        }
      },
      "scale": [
        {
          "v": "elasticity",
          "ref": 0.9,
          "keys": ["s3"]
        }
      ],
      "sponsor": "biz",
      "serves": ["monetise"],
      "needs": {
        "level": 1
      },
      "risky": true
    },
    {
      "id": "usage_addon",
      "name": "Usage-based add-on",
      "about": "A metered add-on for the heaviest users (projects, exports, storage).",
      "area": "monetise",
      "eng": 24,
      "design": 4,
      "data": 2,
      "clar": 0.4,
      "debt": 2,
      "effects": {
        "mid": {
          "arpu": 0.1484,
          "churn": 0.02226
        },
        "ent": {
          "arpu": 0.13356
        }
      },
      "scale": [
        {
          "v": "addon_wtp",
          "ref": 1.1,
          "keys": ["arpu"]
        }
      ],
      "side_cost": {
        "per_quarter": 47.175
      },
      "sponsor": "biz",
      "serves": ["monetise"],
      "needs": {
        "level": 1
      },
      "risky": true,
      "big": true
    },
    {
      "id": "annual_plan",
      "name": "Annual-plan upsell",
      "about": "A discount for paying annually, in the app and at renewal.",
      "area": "retention",
      "eng": 9,
      "design": 2,
      "data": 0,
      "clar": 0.8,
      "debt": 0,
      "effects": {
        "solo": {
          "churn": 0.3204,
          "arpu": -0.04,
          "s3": 0.0712
        },
        "mid": {
          "churn": 0.2136,
          "arpu": -0.03
        }
      },
      "sponsor": "biz",
      "serves": ["retain"]
    },
    {
      "id": "sso_audit",
      "name": "Single sign-on and audit log",
      "about": "Single sign-on and an audit log, which security reviews at large agencies demand. The sales head's favourite.",
      "area": "enterprise",
      "eng": 27,
      "design": 4,
      "data": 0,
      "clar": 0.6,
      "debt": 3,
      "effects": {
        "ent": {
          "s3": 1.1942,
          "churn": 0.3412
        },
        "mid": {
          "s3": 0.1706
        }
      },
      "scale": [
        {
          "v": "ent_pipeline",
          "ref": 0.75,
          "keys": ["s3", "churn"]
        }
      ],
      "side_cost": {
        "per_quarter": 29.184
      },
      "sponsor": "biz",
      "serves": ["grow", "monetise"],
      "big": true,
      "fav": true
    },
    {
      "id": "billing_rewrite",
      "name": "Billing module rewrite",
      "about": "Rewrite the billing module (proration, taxes, invoices) behind every outage this year. Pays down technical debt.",
      "area": "debt",
      "eng": 36,
      "design": 2,
      "data": 1,
      "clar": 0.4,
      "debt": -14,
      "quality": {
        "rel": 6
      },
      "effects": {
        "solo": {
          "churn": 0.1584
        },
        "mid": {
          "churn": 0.132
        },
        "ent": {
          "churn": 0.1056
        }
      },
      "scale": [
        {
          "v": "billing_share",
          "ref": 0.25,
          "keys": ["churn"]
        }
      ],
      "sponsor": "eng",
      "serves": ["debt", "retain"],
      "big": true
    },
    {
      "id": "integrations",
      "name": "Accounting integrations",
      "about": "Sync with the three accounting tools agencies use.",
      "area": "growth",
      "eng": 24,
      "design": 4,
      "data": 0,
      "clar": 0.6,
      "debt": 2,
      "effects": {
        "mid": {
          "s3": 0.166,
          "churn": 0.0996
        },
        "solo": {
          "s3": 0.0996
        }
      },
      "sponsor": "biz",
      "serves": ["grow", "retain"]
    },
    {
      "id": "mobile_time",
      "name": "Mobile timesheets",
      "about": "A mobile timesheet for people who bill by the hour.",
      "area": "retention",
      "eng": 21,
      "design": 8,
      "data": 0,
      "clar": 0.6,
      "debt": 2,
      "effects": {
        "solo": {
          "s1": 0.091,
          "churn": 0.0728
        },
        "mid": {
          "churn": 0.091
        }
      },
      "sponsor": "design",
      "serves": ["retain"]
    },
    {
      "id": "reporting",
      "name": "Profitability dashboards",
      "about": "Profitability dashboards: margin by client, by project, by person.",
      "area": "monetise",
      "eng": 18,
      "design": 6,
      "data": 0,
      "clar": 0.6,
      "debt": 1,
      "effects": {
        "mid": {
          "arpu": 0.0304,
          "churn": 0.019
        },
        "ent": {
          "arpu": 0.0228
        }
      },
      "sponsor": "biz",
      "serves": ["monetise", "retain"]
    },
    {
      "id": "design_system",
      "name": "Design system rollout",
      "about": "Roll out one component library across the app.",
      "area": "quality",
      "eng": 15,
      "design": 12,
      "data": 0,
      "clar": 0.7,
      "debt": -4,
      "quality": {
        "use": 10
      },
      "effects": {
        "solo": {
          "s1": 0.042
        },
        "mid": {
          "s1": 0.028
        }
      },
      "sponsor": "design",
      "serves": ["quality"]
    },
    {
      "id": "perf_reliability",